"","CitationCode","Reference","CreationDate","ModificationDate","ReadBy","GetIt","nvpCount"
"1",1,"Jaques, R.P., Hardman, J.M., Laing, J.E., Smith, R.F., and Bent, E.1994.  Orchard trials in Canada on control of Cydia pomonella (Lep.: Tortricidae) by granulosis virus.  Entomophaga 39: 281-292.","1/8/2096","7/8/2096","","",NA
"2",2,"Welling, M., Nachtigall, G., and Zimmermann, G. 1994.  Metarhizium spp. isolates from Madagascar: morphology and effect of high temperature on growth and infectivity to the migratory locust, Locusta migratoria.  Entomophaga 39:351-361.","1/8/2096","7/8/2096","","",3
"3",5,"Bordat, D., Goudegnon, A.E., and Bouix, G. 1994.  Relationship between Apanteles flavipes (Hym.: Braconidae) and Nosema bordati (Microspora, Nosematidae) parasites of Chilo partellus (Lep.: Pyralidae).  Entomophaga 39: 21-32.","1/8/2096","7/8/2096","","",1
"4",7,"Papierok, B., Rafanomezantsoa-Randriambololona, B. N., and Ziat, N. 1994. Nouvelles donnees sur l'ecologie et le comportment entomopathogene experimental de l' entomophthorale Conidiobolus coronatus (Zygomycetes). Entomophaga 38: 299-312. ","1/8/2096","7/8/2096","","",2
"5",8,"Glare, T.R., Jackson, T.A., and Zimmerman, G. 1994.  Occurrence of Bacillus popilliae and two nematode pathogens in populations of Amphimallon solstitialis (Co.: Scarabaeidae) near Darmstadt, Germany.  Entomophaga 38: 441-450.","1/8/2096","7/8/2096","","",1
"6",9,"Bellini, R., Mullens, B.A., and Jespersen, J.B. 1992. Infectivity of two members of the Entomophthora muscae complex (Zygomycetes: Entomophthorales) for Musca domestica (Dipt.: Muscidae).  Entomophaga 37: 11-19.","1/8/2096","7/8/2096","","",1
"7",10,"Lamb, D.J., and Foster, G.N. 1986.  Some observations on Strongwellsea castrans (Zygomycetes: Entomophthorales), a parasite of root flies (Delia spp.) in the south of Scotland.  Entomophaga  31:91-97","1/8/2096","3/26/2097","","",1
"8",12,"Meynadier, G., Amargier, A., Girardie, J., and Vago, C. 1992. Une entomopoxvirose chez l'Orthoptere Anacridium aegyptium.  Entomophaga 37: 453-464.","1/8/2096","7/8/2096","","",NA
"9",13,"Bing, L.A., and Lewis, L. C. 1992.  Temporal relationships between Zea mays, Ostrinia nubilalis (Lep.: Pyralidae) and endophytic Beauveria bassiana.  Entomophaga 37: 525-536.","1/8/2096","7/8/2096","","",1
"10",14,"Fargues, J., and Maniania, N.K. 1992.  Variabilite de la sensibilite de Spodoptera littoralis (Lep.: Noctuidae) a l'Hyphomycete Entomopathogene Nomuraea riley.  Entomophaga 37: 545-554.","1/8/2096","7/8/2096","","",1
"11",15,"Kunimi, Y. 1993. A list of insect diseases of Japanese insects.  In Iwahana H.,  Okada M., Kunimi Y., and Shimazu M.  [eds.], Manual for the Research on Insect Pathogens. Nihon Shokubutuboeki-kyoukai, Tokyo, p222.","1/8/2096","7/12/2096","","",498
"12",16,"Humber, R.A. 1992. Collection of entomopathogenic fungal cultures: catolog of strains, 1992. U.S. Department of Agriculture, Agriculture Research Service. ARS-110. 177pp. (Plant Protection Research Unit, U.S. Plant, Soil, and Water Laboratory, Tower Rd., Ithaca, N. Y. 14853-0331.)","1/8/2096","6/23/2000","","",670
"13",17,"Keller, S., 1994. The fungus Zoophthora elateridiphaga as an important mortality factor of the click beetle Agriotes sputator.  J. Invertebr. Pathol. 63: 90-91.","1/8/2096","7/8/2096","","",1
"14",18,"Maddox, J. 1993. Protozoa and virus germplasm collection. Illinois Natural History Survey, 607 East Peabody Dr., Champaign, IL 61820","1/8/2096","10/7/2096","","",33
"15",19,"Ni, X., Backus, E.A., and  Maddox, J.V. 1995. A new microsporidium, Nosema empoascae n. sp., from Empoascae fabae (Harris) (Homoptera: Auchenorrhyncha: Cicadellidae). J. Invertebr. Pathol. 66: 52-59.","1/8/2096","7/8/2096","","",1
"16",20,"Sotoshiro, H. and Kobayashi, M., 1995. Identification of viral structural polypeptides in the midgut and feces of the silkworm, Bombyx mori, infected with Bombyx Densovirus Type 2.  J. Invertebr. Pathol. 66: 60-67.","1/8/2096","7/8/2096","","",NA
"17",22,"Smallridge, C.J., Cooper, D.J., and Pinnock, D.E., 1995. The effect of the microsporidium Octosprea muscaedomesticae on adult Lucilia cuprina (Diptera: Calliphoridae).  J. Invertebr. Pathol. 66: 196-197.","1/8/2096","7/8/2096","","",1
"18",23,"Theilman, D.A., Fitzpatrick, S.M., and Skelton, F., 1995. Identification of a Granulosis Virus associated with mortality in the Blackheaded Fireworm, Rhopobota naevana (Hubner) (Lepidoptera, Tortricidae). J. Invertebr. Pathol. 66: 209-211.","1/8/2096","7/8/2096","","",NA
"19",24,"Martignoni, M.E. and Iwai, P.J.  A catalogue of viral diseases of insects, mites and ticks. Appendix 2 [pp. 899-912] In, H.D. Burges (ed.) Microbial Control of Pests and Plant Diseases, 1970-1980.  London:  Academic Press, 1981. 949 pp.","1/8/2096","9/26/2000","","",1
"20",25,"Martignoni, M.E., and Iwai, P.J., 1986. A Catalogue of Viral Diseases of insects, Mites, and Ticks. USDA Forest Service, Pacific Northwest Research Station, Portland, OR, General Technical Report PNW-195, 4th edition,51 pp.","1/8/2096","7/12/2096","","",3
"21",26,"Brooks, W. M. 1993. Host-parasitoid-pathogen interactions; Chapter 11. In  Ignoffo, C.M., et al. [eds.] Parasites and Pathogens of Insects. Vol. 2: Pathogens. Academic Press. Inc.","1/8/2096","2/7/2097","","",55
"22",27,"Sprague, V. 1977. Annotated List of Species of Microsporidia. pp. 31-334. In Bulla, L.A. and Cheng, T.C. [eds.], Comparative Pathobiology V. 2; Systematics of the Microsporidia. Plenum Press, New York","1/8/2096","7/8/2096","","",734
"23",28,"Sprague, V., Becnel, J. J., and Hazard, E. I., 1992. Taxonomy of phylum Microspora. Critical Reviews in Microbiology. 18(5/6): 285-395. CRC Press, Inc.","1/8/2096","7/8/2096","","",67
"24",29,"Barber, K.N., Kaupp, W. J., and Holmes, S. B. 1993. Specificity testing of the nuclear polyhedrosis virus of the gypsy moth, Lymantria dispar (L.) (Lepidoptera:Lymantriidae). Can. Entomol.  125:1055-1066.","1/8/2096","7/8/2096","","",NA
"25",30,"Steinhaus, E.A.; and Marsh, G.A. 1967. Previously unreported accessions for diagnosis and new records.  Journal of Invertebrate Pathology 9(3):436-438","1/8/2096","6/16/2000","smb","",12
"26",31,"Morel, Gilles. (personal communication) Department de Biologie, Universite de la Reunion, 97715 Saint Denis Messag CEDEX 9, France.","1/8/2096","7/12/2096","","",NA
"27",32,"Fouillaud, M. and Morel, G., 1994.  Characterization of cytoplasmic and nuclear polyhedrosis viruses recovered from the nest of Polistes hebraeus F. (Hymenoptera: Vespidae).  J. of Invertebr. Pathol. 64: 89-95.","1/8/2096","7/8/2096","","",NA
"28",33,"Iwano, H. and Ishihara, R., 1984.  A microsporidian, Pleistophora sp., isolated from the lawn grass cutworm, Spodoptera depravata Butler (Lepidoptera: Noctuidae). Bull. Coll. Agr. and Vet. Med., Nihon Univ. 41: 25-33.","1/8/2096","7/12/2096","","",1
"29",34,"Iwano, H. and Kurtti, T. J. 1995. Identification and isolation of dimorphic spores from Nosema furnacalis (Microspora:Nosematidae). J. Invertebr. Pathol.  65: 230-236.","1/8/2096","7/8/2096","","",1
"30",35,"Vargas-Osuna, E., Aldebis, H.K., Caballero, P., Lipa, J.J. and Santiago-Alvarez, C. 1994. A newly described Baculovirus (Subgroup B) from Ocnogyna baetica (Rambur) (Lepidoptera: Arctiidae) in Southern Spain.  J. Invertebr. Pathol. 63: 31-36.","1/8/2096","2/7/2097","","",NA
"31",37,"Sait, S.M., Begon, M., and Thompson, D.J. 1994. The influence of larval age on the response of Plodia interpunctella  to a granulosis virus.  J. Invertebr. Pathol. 63: 107-110.S.M. ","1/8/2096","7/8/2096","","",NA
"32",39,"Lefol, C., Lherminier, J., Boudon-Padieu, E., Larrue, J., Louis, C., and Caudwell, A. 1994. Propagation of Flavescence doree MLO (Mycoplasma-like Organism) in the leafhopper vector Euscelidius variegatus KBM. J. Invertebr. Pathol. 63: 285-293.","1/8/2096","7/8/2096","","",2
"33",40,"Gilliam, M., Lorenz, B.J., and Buchmann, S.L. 1994. Ascophaera apis, the chalkbrood pathogen of the honey bee, Apis mellifera, from larvae of a carpenter bee, Xylocopa californica arizonensis. J. Invertebr. Pathol. 63: 307-309.","1/8/2096","7/8/2096","","",1
"34",41,"Gupta, S.C., Leathers, T.D., El-Sayed, G.N, and Ignoffo, C.M. 1994.  Relationships among enzyme activities and virulence parameters in Beauveria bassiana infections of Galleria mellonella and Trichoplusia ni.  J. Invertebr. Pathol. 64: 13-17.","1/8/2096","7/8/2096","","",2
"35",43,"Hanula, J.L. and Andreadis, T.G., 1992.  Protozoan pathogens of the Scarabaeidae.  Pp. 79-91 In Glare, T.R. and Jackson, T.A. [eds.] Use of Pathogens in Scarab Pest Management. Intercept Ltd. Andover, England.","1/8/2096","8/24/2000","smb","",44
"36",44,"Andreadis, T.G. 1994. Host range tests with Edhazardia aedis (Microsporida Culicosporidae) against northern neartic mosquitoes.  J. Invertebr. Pathol. 64: 46-51.","1/8/2096","7/8/2096","","",4
"37",45,"Weseloh, R. M. and Andreadis, T. G., 1992.  Epizootiology of the fungus Entomophaga maimiga, and its impact on gypsy moth populations.  J. Invertebr. Pathol. 59: 133-141.","1/8/2096","7/17/2097","","",1
"38",46,"Latge, J. P. and Papierok, B. 1988. Aphid pathogens. pp 323-335. In  Minks, A.K. and Harrewijn, P. [eds.], Aphids: Their Biology, Natural Enemies, and Control. Elsevier, Amsterdam.","1/8/2096","7/16/2097","","",1
"39",47,"Soper, R.S., and Ward, M.G. 1981. Production, formulation and application of fungi for insect control. pp.161-180. In, Beltsville Symposia in Agricultural Research [5]: Biological Control in Crop Production. Allanheld, Osmun & Co. Totowa, New Jersey.","1/8/2096","7/8/2096","","",4
"40",48,"Vandenberg, J.D. 1992. Bioassay of the chalkbrood fungus Ascosphaera aggregata on larvae of the alfalfa leafcutting bee, Megachile rotundata.  J. Invertebr. Pathol. 60: 159-163.","1/8/2096","7/8/2096","","",1
"41",50,"McCoy, C.W., and Boucias, D.G. 1989. Selection of Beauveria bassiana pathotypes as potential microbial agents of soil-inhabiting citrus weevils. Mem. Inst. Oswaldo Cruz, Rio de Janeiro, 84: 75-80.","1/8/2096","7/8/2096","","",4
"42",51,"Zoberi, M.H. 1995. Metarhizium anisopliae, a fungal pathogen of Reticulitermes flavipes (Isoptera: Rhinotermitidae). Mycologia 87: 354-359.","1/8/2096","7/8/2096","","",1
"43",54,"Guy, P.L., Toriyama, S. and Fuji, S. 1992. Occurrence of a picorna-like virus in planthopper species and its transmissioon in Laodelphax striatellus. J. Invertebr. Pathol. 59: 161-164.","1/8/2096","7/8/2096","","",NA
"44",55,"Inglis, G.D., Feniuk, R.P., Goettel, M.S., and Johnson, D.L. 1995.  Mortality of grasshoppers exposed to Beauveria bassiana during oviposition and nymphal emergence. J. Invertebr. Pathol. 65: 139-146.","1/8/2096","7/8/2096","","",1
"45",57,"Darwish, A., Brooks, W.M., and Moore, C.B. 1992. Ultrastructural observations and taxonomic considerations of a miscrosporidium of the larch sawfly, Pristiphora erichsonii: conspecificity with Thelohania pristiphorae and Pleistophora sp.  J. Invertebr. Pathol. 59(2): 178-185.","1/8/2096","7/20/2099","","",1
"46",58,"Khachatourians, G.G. 1992. Virulence of five Beauveria strains, Paecylomyces farinosus, and Verticillium lecanii against the migratory grasshopper, Melanoplus sanguinipes. J. Invertebr. Pathol. 59: 212-214.","1/8/2096","7/8/2096","","",7
"47",60,"Zimmermann, G. and Weiser, J. 1991. Pathogens and diseases. pp. 253-271. In van der Geest, L. P. S. and Evenhuis, H.H. [eds.], Tortricid Pests: Their Biology, Natural Enemies and Control. Elsevier Science Publishers, Amsterdam.","1/8/2096","7/8/2096","","",52
"48",61,"Henry, J. E., 1981. Natural and applied control of insects by protozoa. Ann. Rev. Entomol. 26: 49-73.","1/8/2096","6/16/2099","","",35
"49",62,"Canning, E. U. 1981. Insect control with protozoa. Pp. 201-216 In  Beltsville Symposia in Agricultural Research [5]: Biological Control in Crop Production. Allanheld, Osmun & Co. Totowa, New Jersey. ","1/8/2096","4/9/2099","","",12
"50",63,"Purrini, K. and Skatulla, U. 1979. Uber die naturlichen Krankheiten der Frostspanner Operophtera brumata  L. und Erranis defoliaria  Clark (Lep. Geometridae) in Spessart, Bayern. Anz. schadlingskde., Pflanzenschutz, Umweltschutz, 52: 20-24.","1/8/2096","7/8/2096","","",1
"51",64,"Gaugler, R.R., and Brooks, W.M. 1975. Sublethal effects of infection by Nosema heliothidis in the corn earworm Heliothis zea.  J. Invertebr. Pathol. 26: 57-63.","1/8/2096","7/12/2096","","",1
"52",66,"Garcia, J.J. and Becnel, J.J. 1994. Eight new species of microsporidia (Microspora) from Argentine mosquitoes (Diptera: Culicidae).  J. Invertebr. Pathol. 64: 243-252.","1/8/2096","7/8/2096","","",8
"53",67,"De Buron, I. and Beckage, N.E. 1992. Characterization of a Polydnavirus (PDV) and a virus-like filamentous particle (VLFP) in the Braconid wasp Cotesia congregata (Hymenoptera: Braconidae).  J. Invertebr. Pathol. 59: 315-327.","1/8/2096","7/8/2096","","",NA
"54",70,"Dunphy, G.B. and Bourchier, R.S. 1992. Responses of nonimmune larvae of the gypsy moth, Lymantria dispar, to bacteria and the influence of tannic acid.  J. Invertebr. Pathol. 60: 26-32.","1/8/2096","7/8/2096","","",NA
"55",71,"Woods, S.A., Streett, D.A., and Henry, J. E. 1992. Temporal patterns of mortality from an Entomopoxvirus and strategies for control of the migratory grasshopper (Melanoplus sanguinipes F.).  J. Invertebr. Pathol. 60: 33-39.","1/8/2096","7/8/2096","","",NA
"56",72,"Laubscher, J. M., Jaffer, M.A., and von Wechmar, M.B. 1992.  Detection by immunogold cytochemical labeling of Aphid Lethal Paralysis Virus in the Aphid Rhopalosiphum padi (Hemiptera: Aphididae).  J. Invertebr. Pathol. 60: 40-46.","1/8/2096","7/8/2096","","",NA
"57",76,"Henry, J.E. 1969. Extension of the host range of Nosema locustae in Orthoptera.  Ann. Entomol. Soc. Amer. 62:452-453.","1/8/2096","6/16/2099","","",31
"58",77,"Diarra, K., and Toguebaye, B.S. 1991. On the development cycle and ultrastructure of Vavraia culicis Weiser, 1947 (Microsporida: Pleistophoridae) with comments on the taxonomy of the genus Vavraia Weiser, 1977.  European J. Protistology  27:134-140.","1/8/2096","7/20/2096","","",1
"59",78,"Andreadis, T. G. 1988. Amblyospora connecticus sp. nov. (Microsporida: Amblyosporidae): horizontal transmission studies in the mosquito, Aedes cantator and formal description.  J. Invert. Pathol. 52:90-101.","1/8/2096","7/17/2097","","",1
"60",79,"Glare, T.R., and Crawford, A.M. 1992. Viral diseases of scarabs. pp 21-32. In Glare, T.R.  and Jackson, T.A. [eds.], Use of Pathogens in Scarab Pest Management. Intercept Ltd. Andover, England.","1/8/2096","7/8/2096","","",NA
"61",80,"Kalmakoff, J., Moore, S., and Pottinger, R.P. 1972.  An iridescent virus from the grass grub Costelytra zealandica: serological study.  J. Invertebr. Pathol. 20: 70-76.","1/8/2096","7/12/2096","","",NA
"62",81,"Moore, S.G., Kalmakoff, J.S., and Miles, J.A.R. 1974. An iridescent virus and a rickettsia from the grass grub Costelytra zealandica (Coleoptera: Scarabaeidae). N. Z. J. Zool. 1: 205-210.","1/8/2096","7/14/2096","","",NA
"63",84,"Otvos, I. S. 1991. North American species in forests. pp. 719-756. In  van der Geest, L.P.S. and Evenhuis, H.H. [eds.], Tortricid Pests: Their Biology, Natural Enemies and Control. Elsevier Science Publishers, Amsterdam.","1/8/2096","7/16/2097","","",3
"64",85,"Evans, H. C. and Prior, C. 1990. Entomopathogenic Fungi. pp. 3-17. In Rosen, D. [ed.], Armored Scale Insects. Their Biology, Natural Enemies, and Control. vol. B. Elsevier Science Publishers. Amsterdam.","1/8/2096","2/20/2001","","requested item to see if I could track down the San Thome locality.",195
"65",86,"Moore, D., Reed, M., Le Pantourel, G., Abraham, Y.J., and Prior, C. 1992. Reduction of feeding by the desert locust, Schistocerca gregaria after infection with Metarhizium flavoviride. J. Invertebr. Pathol. 60: 304-307.","1/8/2096","7/8/2096","","",1
"66",87,"Vacante, V., Cacciola, S.O., and Pennisi, A.M. 1994. Epizootiological study of Neozygites parvispora (Zygomycota: Entomophthoraceae) in a population of Frankliniella occidentalis (Thysanoptera: Thripidae) on pepper in Sicily.   Entomophaga 39: 123-130.","1/8/2096","7/8/2096","","",1
"67",88,"Ignoffo, C.M. The fungus Nomuraea rileyi as amicrobial insecticide. Chapter 27 [pp. 513-538] In, H.D. Burges (ed.) Microbial Control of Pests and Plant Diseases, 1970-1980.  London:  Academic Press, 1981. 949 pp.","1/8/2096","9/26/2000","","",23
"68",89,"Dongrui, L., Yuneng, C., Daiyue, L., Qilin, Z., Yuanyang, H., Huajun, H., Kebin, Z. 1986. The Atlas of Insect Viruses in China. 146pp + plates.","1/8/2096","7/8/2096","","",NA
"69",91,"Ignoffo, C. M., Garcia, C., Zuidema, D., and Vlak, J.M. 1995. Relative in vivo activity and simulated sunlight-uv stability of inclusion bodies of a wild-type and an enginneered polyhedral envelope-negative isolate of the Nucleopolyhedrosis Virus of Autographa californica.  J. Invertebr. Pathol. 66: 212-213.","1/8/2096","7/8/2096","","",NA
"70",92,"Arne, C. N., and Nordin, G. L. 1995. Enhancement of indices of viral infection by simultaneously administering Helicoverpa zea and Autographa californica Nuclear Polyhedrosis Viruses to larval Helicoverpa zea (Boddie). J. Invertebr. Pathol. 66: 18-24.","1/8/2096","7/8/2096","","",NA
"71",93,"Sikorowski, P.P.,  and Lawrence, A.M. 1994. Heliothis Cytoplasmic Polyhedrosis Virus and its effect upon microbial contaminant-free Heliothis virescens.  J. Invertebr. Pathol.  63: 56-62.","1/8/2096","7/8/2096","","",NA
"72",94,"Taniai, K., and Yamakawa, M. 1992. Characterization of a Nuclear Polyhedrosis Virus from a Japanese oak silkworm, Antheraea yamamai. J. Invertebr. Pathol. 60: 314-316.","1/8/2096","7/8/2096","","",NA
"73",95,"White, S.E., Fukuda, T., and Undeen, A.H. 1994. Horizontal transmission of Amblyospora opacita (Microspora:Amblyosporidae) between the mosquito, Culex territans, and the copepod, Paracyclops fimbriatus chiltoni. J. Invertebr. Pathol. 63: 19-25.","1/8/2096","7/8/2096","","",1
"74",96,"De Graaf, D.C., Raes, H., Sabbe, G., de Rycke, P.H., and Jacobs, F.J. 1994. Early development of Nosema apis (Microspora: Nosematidae) in the midgut epithelium of the honybee (Apis mellifera). J. Invertebr. Pathol. 63: 74-81.","1/8/2096","7/8/2096","","",1
"75",97,"Canning, E. U. 1960. Two new microsporidian parasites of the winter moth Operophtera brumata (L.). J. Parasitol. 46: 755-762.","1/8/2096","2/21/2099","","",4
"76",98,"Bass, L.K., and Armstrong, E. 1992. Nosema whitei: Effects on oocyte development and maturation in Tribolium castaneum.  J. Invertebr. Pathol. 59: 115-123.","1/8/2096","7/8/2096","","",1
"77",100,"Jackson, T.A. 1995. Amber disease reduces trypsin activity in midgut of Costelytra zealandica (Coleoptera; Scarabaeidae) larvae.  J. Invertebr. Pathol.  65: 68-69.","1/8/2096","7/8/2096","","",2
"78",101,"Allardyce, R.A., Keenan, J.I.,  O'Callaghan, M., and Jackson, T. A., 1991.  Serological identification of Serratia entomophaga, a bacterial pathogen of the New Zealand grass grub (Costelytra zealandica).   J. Invertebr. Pathol. 57: 250-254. ","1/8/2096","7/8/2096","","",1
"79",102,"Grimont, P.A.D., Jackson, T.A., Ageron, E. and Noonan, M.J., 1988. Serratia entomophilia sp. nov. associated with amber disease in the New Zealand grass grup Costelytra zealandica.  Int. J. Syst. Bacteriol. 38: 1-6.","1/8/2096","7/8/2096","","",1
"80",103,"Stucki, G., Jackson, T.A., Noonan, M.J., 1984.  Isolation and characterization of Serratia strains pathogenic for larvae of the New Zealand grass grub Costelytra zealandica.  N. Z. J. Sci. 27: 255-260.","1/8/2096","7/8/2096","","",1
"81",104,"Trought, T.E.T., Jackson, T.A., and French, R.A., 1982. Incidence and transmission of a disease of grass grub (Costelytra zealandica) in Canterbury.  N. Z. J. Exp. Agric. 10: 79-82.","1/8/2096","7/8/2096","","",1
"82",105,"Glare, T.R., 1992.  Further electron microsopic evidence of inapparent viral infections in the midgut of the New Zealand grass grub, Costelytra zealandica (Col: Scarabeidae).   J.  Invert. Pathol. 59: 206-209.","1/8/2096","7/8/2096","","",NA
"83",106,"Poinar, R.H., Poinar, G.O. Jr., and Jackson, T., 1991.  Electron microscope evidence of a new virus in the grass grub, Costelytra zealandica (Coleoptera: Scarabaeidae).   J.  Invertebr. Pathol. 57: 137-140.","1/8/2096","7/8/2096","","",NA
"84",107,"Dearing, S.C., Scotti, P.D., Wigley, P.J., and Dhana, S.D. 1980.  A small RNA virus isolated from the grass grub, Costelytra zealandica (Col: Scarabaeidae).   N. Z. J. Zool. 7: 267-269.","1/8/2096","7/23/2096","","",NA
"85",108,"Scotti, P.D., Dearing, S.C., and Mossop, D.W., 1983.   Flock House virus: A Nodavirus isolated  from Costelytra zealandica (White) (Coleoptera: Scarabaeidae).  Arch. Virology. 75: 181-189.","1/8/2096","7/8/2096","","",NA
"86",109,"Scotti, P.D. and Fredericksen, S., 1987.   Manawatu virus: a Nodavirus isolated from Costelytra zealandica (White) (Coleoptera: Scarabaeidae)Arch. Virology. 97: 85-92.","1/8/2096","7/8/2096","","",NA
"87",110,"Wilson, C.J., Mahanty, H.K., and Jackson, T.A. 1992. Biocontrol Sci. Technol. 2: 59-64.","1/8/2096","9/19/2099","","Get title",1
"88",111,"Glare, T.R. 1992. Hirsutella stylophora Mains, a pathogen of Costelytra zealandica (Coleoptera: Scarabaeidae) in New Zealand.  N. Z. Entomol. 15: 29-32.","1/8/2096","7/12/2096","","",1
"89",112,"Malone, L.A. 1990. N. Z. J. Agric. Res. 33: 459-465.","1/8/2096","7/8/2096","","",2
"90",113,"Miln, A. J. 1978.  Protozoan parasites of Costelytra zealandica (Coleoptera: Scarabaeidae) in New Zealand.   New Zealand Entomologist 6(4): 392-399.","1/8/2096","4/12/2099","smb","",4
"91",114,"Fowler, M., 1974.  Occurrence and experimental infection in larvae of Costelytra zealandica and other Scarabaeidae.   N. Z. J. Zool. 1:97-109.","1/8/2096","7/8/2096","","",1
"92",115,"Drea, J. J. and Gordan, R. D. 1990. Coccinellidae. pp.19-40. In Rosen, D. [ed.], Armored Scale Insects. Their Biology, Natural Enemies, and Control. vol. B. Elsevier Science Publishers. Amsterdam.","1/8/2096","7/16/2097","","",5
"93",116,"Jackson, T.A., and Glare, T.R. 1992. Rickettsial diseases of scarabs. pp. 33-42. In  Glare, T.R. and Jackson, T.A. [eds.], Use of Pathogens in Scarab Pest Management. Intercept Ltd. Andover, England.","1/8/2096","7/8/2096","","",26
"94",117,"Klein, M.G. and Jackson, T.A. 1992. Bacterial diseases of scarabs. pp. 33-42. In  Glare, T.R. and Jackson, T.A. [eds.], Use of Pathogens in Scarab Pest Management. Intercept Ltd. Andover, England.","1/8/2096","7/8/2096","","",40
"95",119,"Humber, R.A. 1995. Collection of entomopathogenic fungal cultures (unpublished) U.S. Department of Agriculture, Agriculture Research Service, Plant Protection Research Unit, U.S. Plant, Soil, and Water Laboratory, Tower Rd., Ithaca, N. Y. 14853-0331.","1/8/2096","6/23/2000","","",76
"96",120,"Humber, R.A. 1986. USDA-ARS collection of entomopathogenic fungal cultures; catolog of strains. USDA-ARS Plant Protection Research Unit, US Plant, Soil, and Water Laboratory, Tower Rd., Ithaca, N. Y. 14853-0331.","1/8/2096","7/8/2096","","",45
"97",121,"McDonald, D.M. and Nolan, R.A. 1995. Effects of relative humidity and temperature on Entomophaga aulicae conidium discharge from infected eastern hemlock looper larvae and subsequent conidium development.  J. Invertebr. Pathol. 65:83-90.","1/8/2096","7/8/2096","","",NA
"98",122,"Krueger, S., Villani, M.G., Martins, A.S., and Roberts, D.W.  1992. Efficacy of soil applications of Metarhizium anisopliae Sorokin conidia, and standard lyophilized mycelial particles against scarab grubs. J. Invertebr. Pathol. 59:54-60.","1/8/2096","7/8/2096","","",1
"99",123,"Xu , J.,  and Hukuara, T., 1994. Biochemical properties of an enhancing factor of an Entomopoxvirus.  J. Invertebr. Pathol. 63: 14-18.","1/8/2096","7/8/2096","","",NA
"100",124,"Gijzen, M., Roelvink, P., and Granados, R. 1995. Characterization of viral enhancing activity from Trichoplusia ni Granulosis Virus.  J. Invertebr. Pathol. 65: 289-294.","1/8/2096","7/8/2096","","",NA
"101",125,"Barson, G., Renn, N., and Bywater, A.F. 1994.  Laboratory evaluation of six species of entomopathogenic fungi for the control of the house fly (Musca domestica L.), a pest of intensive animal units.  J. Invertebr. Pathol. 64: 107-113.","1/8/2096","7/8/2096","","",5
"102",126,"Schenkel, R.G.M., Nicolas, L., Franchon, E., and Hamon, S. 1992. Characterization and toxicity to mosquito larvae of four Bacillus sphaericus strains isolated from Brazilian soils. J. Invertebr. Pathol. 60: 10-14.","1/8/2096","7/8/2096","","",3
"103",127,"van der Geest, L.P.S., 1985.  Pathogens of spider mites. pp. 247-258. In  W. Helle and Sabelis, M.W.,  [eds.], Spider Mites: Their Biology, Natural Enemies and Control Vol. 1B.  Elsevier Science Publishers, Amsterdam.","1/8/2096","7/16/2097","","",19
"104",128,"Brown, G.C., and Hasibuan, R. 1995.  Conidial discharge and Transmission efficiency of Neozygites floridana, an entomopathogenic fungus infecting Two-spotted Spider mites under laboratory conditions.  J. Invertebr. Pathol.  65: 10-16.","1/8/2096","7/8/2096","","",1
"105",129,"Hodge, K.T., Sawyer, A.J., and Humber, R.A. 1995. RAPD-PCR for identification of Zoophthora radicans isolates in biological control of the Potato Leafhopper.  J. Invertebr. Pathol. 65: 1-9","1/8/2096","7/8/2096","","",1
"106",130,"Sanchez-Pena, S.R., and Thorvilson, H. G. 1995. Effect of long-term storage and conidial suspending agents on the virulence of Beauveria bassiana towardSolenopsis invicta.  J. Invertebr. Pathol. 65: 248-252.","1/8/2096","7/8/2096","","",1
"107",131,"Doyle, C.J., Hirst, M.L., Cory, J.S., and Entwistle, P.F. 1990. Risk assessment studies: detailed host range testing of wild-type cabbage moth, Mamestra brassicae  (Lepidoptera: Noctuidae) nuclear polyhedrosis virus. Appl. Environ. Microbiol. 56: 2704-2710.","1/8/2096","7/8/2096","","",NA
"108",133,"Ishihara, R., 1995. College of Agriculture and Veterinary Medicine, Nihon University, Japan. unpublished data.","1/8/2096","7/18/2096","","",1
