"","CitationCode","Reference","CreationDate","ModificationDate","ReadBy","GetIt","nvpCount"
"446",495,"Zacharuk, R.Y., Leung, E.S., and Jensen, J.C., 1992.  Viruslike particles in cells associated with sensilla in head appendages of a dytiscid beetle.  Can. J. Zool. 70:67-70.","5/1/2096","7/8/2096","","",NA
"447",496,"Arif, B.M., Guangyu, Z., and Jamieson, P., 1986.  A comparison of three granulosis viruses isolated from Choristoneura spp.  Invertebr. Pathol. 48:180-186.","5/1/2096","7/8/2096","","",NA
"448",497,"Rothman, L.D., and Myers, J.H., 1994.  Nuclear polyhedrosis virus treatment effect on reproductive potential of western tent caterpillar (Lepidoptera: Lasiocampidae).  Environ. Entomol. 23(4):864-869.","5/1/2096","7/8/2096","","",NA
"449",498,"Poprawski, T. J. and Yule, W. N., 1992.  Actinocephalus sp., a protozoan (Eugregarinida: Actinocephalidae) associated with June beetles, Phyllophaga Harris (Coleoptera: Scarabaeidae).  Can. Ent. 124:391-396.","5/1/2096","7/17/2097","","",NA
"450",499,"Tu, C.M., and Harris, C.R., 1988.  A description of the development and pathogenicity of Entomophthora muscae (Cohn) in the onion maggot, Delia antiqua (Meigen).  Agriculture, Ecosystems and Environment 20:143-146.","5/1/2096","7/8/2096","","",1
"451",500,"Johnson, D.L., Huang, H.C., and Harper, A.M., 1988.  Mortality of grasshoppers (Orthoptera: Acrididae) inoculated with a Canadian isolate of the fungus Verticillium lecanii.  J. Invertebr. Pathol. 52:335-342.","5/1/2096","7/8/2096","","",1
"452",501,"Todorova, S.I., Cote, J.-C., Martel, P., and Coderre, D., 1994.  Heterogeneity of two Beauveria bassiana strains revealed by biochemical tests, protein profiles and bio-assays on Leptinotarsa decemlineata (Col.: Chrysomelidae) and Coleomegilla maculata lengi (Col.: Coccinellidae) larvae.  Entomophaga 39(2):159-169.","5/1/2096","7/8/2096","","",2
"453",502,"Tyrrell, D., 1990.  Pathogenesis of Entomophaga aulicae  I.  Disease symptoms and effect of infection on weight gain of infected Choristoneura fumiferana and Malacosoma disstria larvae.  J. Invertebr. Pathol. 56:150-156.","5/1/2096","7/8/2096","","",1
"454",503,"Tu, C.M.  1990.  In Vitro isolation of Entomophthora muscae (Entomophthorales: Entomophthoraceae) from infected seed corn maggot Delia platura (Diptera: Anthomylidae).  J. Invertebr. Pathol. 55:289-290.","5/1/2096","7/8/2096","","",1
"455",504,"Perry, D.F., and Fleming, R.A.  1989.  Erynia crustosa zygospore germination.  Mycologia 81(1):154-158.","5/1/2096","7/8/2096","","",NA
"456",505,"Perry, D.F., 1988.  Germination of Erynia bullata resting spores.  J. Invertebr. Pathol. 51:161-162.","5/1/2096","7/8/2096","","",NA
"457",506,"Wagner, D.L., Tobi, D.R., Parker, B.L., Wallner, W.E., and Leonard, J.G., 1989.  Immature stages and natural enemies of Korscheltellus gracilis (Lepidoptera: Hepialidae).  Ann. Entomol. Soc. Am. 82(6):717-724.","5/1/2096","7/8/2096","","",NA
"458",507,"Harcourt, D.G., and Guppy, J.C., 1991.  Numerical analysis of an outbreak of the alfalfa weevil (Coleoptera: Curculionidae) in Eastern Ontario.  Environ. Entomol. 20(1)217-223.","5/1/2096","7/8/2096","","",1
"459",508,"Ben-Zeev, I.S., and Jaques, R.P., 1990.  Entomopathogenic fungi in insects in alfalfa fields in southwestern Ontario.  Proc. Ent. Soc. Ont. 121:71-78.","5/1/2096","7/8/2096","","",2
"460",509,"Harney, S., and Widden, P., 1990.  Physiological properties of the entomopathogenic hyphomycete Paecilomyces farinosus in relation to its role in the forest ecosystem.  Can. J. Bot. 69:1-5.","5/1/2096","7/8/2096","","",NA
"461",510,"Goettel, M.S., 1987.  Preliminary field trials with the entomopathogenic hyphomycete Tolypocladium cylindrosporum in central Alberta.  J. Am. Mosquito Control Assoc. 3(2):239-245.","5/1/2096","7/8/2096","","",NA
"462",511,"Stoltz, D.B., Krell, P., Cook, D., MacKinnon, E.A., and Lucarotti, C.J., 1988.  An unusual virus from the parasitic wasp Cotesia melanoscela.  Virology 162:311-320.","5/1/2096","7/8/2096","","",NA
"463",512,"Poprawski, T.J., and Yule, W.N., 1990.  A new small iridescent virus from grubs of Phyllophaga anxia (LeConte) (Col., Scarabaeidae).  J. Appl. Ent. 110:63-67.","5/1/2096","7/8/2096","","",NA
"464",513,"Poprawski, T.J., and Yule, W.N., 1990.  Bacterial pathogens of Phyllophaga spp. (Col., Scarabaeidae) in southern Quebec, Canada.  J. Appl. Ent. 109:414-422.","5/1/2096","7/8/2096","","",2
"465",514,"Poprawski, T.J., and Yule, W.N., 1991.  Incidence of fungi in natural populations of Phyllophaga spp. and susceptibility of Phyllophaga anxia (LeConte) (Col., Scarabaeidae) to Beauveria bassiana and Metarhizium anisopliae (Deuteromycotina).  J. Appl. Ent. 112:359-365.","5/1/2096","7/8/2096","","",2
"466",515,"Erlandson, M.A., Johnson, D.L., and Olfert, O.O., 1988.  Entomophaga grylli (Fresenius) infections in grasshopper (Orthoptera: Acrididae) populations in Saskatchewan and Alberta 1985-1986.  Can Ent. 120:205-209.","5/1/2096","7/8/2096","","",NA
"467",516,"Moore, K.C., and Erlandson, M.A., 1988.  Isolation of Aspergillus parasiticus Speare and Beauveria bassiana (Bals.) vuillemin from melanopline grasshoppers (Orthoptera: Acrididae) and demonstration of their pathogenicity in Melanoplus sanguinipes (Fabricius).  Can. Ent. 120:989-991.","5/1/2096","7/8/2096","","",NA
"468",517,"Perry, D.F., and Fleming, R.A., 1989.  The timing of Erynia radicans resting spore germination in relation to mycosis of Choristoneura fumiferana.  Can. J. Bot. 67:1657-1663.","5/1/2096","7/8/2096","","",1
"469",518,"Ashford, R.W., 1965. Lymphotropha tribolii gen. nov., sp. nov., Neogregarinida, Schizocystidae, from the haemocoele of Tribolium castaneum (Herbst).  J. Protozool., 12: 609-","5/1/2096","7/8/2096","","",1
"470",519,"Yarwood, E.E., 1937.  The life cycle of Adelina cryptocerci sp. nov., a coccidian parasite of the roach Cryptocercus punctulatus.  Parasitology 29: 370-390.","5/1/2096","4/23/2099","smb","",1
"471",520,"Hostounsky, Z., and Zizka, Z., 1983.  Defense reactions in an unusual host against microsporidian infections. J. Protozool.  30: 32A. ","5/1/2096","2/5/2097","","",1
"472",521,"Weiser, J., 1956. Protozoare infektionen in kampfe gegen insekten, Z. Pflanzenpathol. Pflanzenschutz.  63: 625-","5/1/2096","7/8/2096","","",NA
"473",522,"Ewen, A. B., and Mukerji, M. K. 1980. Evaluation of Nosema locustae (Microsporida) as a control agent of grasshopper populations in Saskatchewan.  J. Invert. Path.  35: 295-303.","5/2/2096","7/8/2096","","",2
"474",527,"Henry, J.E., and Oma, E.A., 1974. Effect of prolonged storage of spores on field applications of Nosema locustae (Microsporida: Nosematidae) against grasshoppers. J. Invertebr. Pathol. 23: 371-","5/4/2096","7/8/2096","","",1
"475",528,"Henry, J. E., Malameba locustae and its antibiotic control in grasshopper cultures. J. Invertebr. Pathol. 11: 224-","5/4/2096","4/28/2099","","",1
"476",529,"Mathis, M., and Baffet, O., 1934. Purification dun elevage dAdes argenteus parasite par un Gregarine, Lankesteria culicics (Ross).  Bull. Soc. Pathol. Exot. 5: 435-","5/5/2096","7/8/2096","","",1
"477",531,"Kilochitskii, P. Y., and Bryginskii, S. A., 1979.  Finding of Lankesteria culicis Ross (Sporozoa, Diplocystidae) in blood-sucking mosquitoes of the Ukraine. Vestn. Zool. 87: ","5/5/2096","7/16/2097","","",6
"478",532,"Vavra, J., 1969. Lankesteria barretti n. sp. (Eugregarinida, Diplocystidae), a parasite of the mosquito Aedes triseriatus (Say) and a review of the genus Lankesteria Mingazzini.  J. Protozool. 16: 546-","5/5/2096","7/8/2096","","",3
"479",533,"Feng, L.C., 1930.  Lankesteria culicis a parasite of Aedes koreicus.  Ann. Trop. Med. Parasitol. 24: 361-","5/5/2096","7/8/2096","","",1
"480",534,"Pillai, J. S., Neill, H. J. C., and Sone, P. F., 1976. Lankesteria culicis a gregarine parasite of Aedes polynesiensis in Western Samoa. Mosq. News. 36: 150-154.","5/5/2096","4/13/2099","","",1
"481",535,"Feng, L.C., 1933. Some parasites of mosquitoes and flies found in China. Lingnan Science Journal 12 (Supplement):  23-31.","5/5/2096","1/18/2099","","",3
"482",536,"Yu, H. S., Cho, H. W., and Pillai, J. S., 1979.  Microbial pathogens of mosquitoes infected with protozoan parasites Tetrahymena and Lankesteria.  Korean J. Entomol. 9: 86-87.,","5/5/2096","7/17/2097","","",4
"483",537,"Levine, N.D., 1977. Revision and checklist of the species (other than Lecudina) of the aseptate gregarine family Lecuninidae. J. Protozool. 24: 41-","5/5/2096","7/8/2096","","",1
"484",538,"Ignoffo, C.M., and Garcia, C., 1965. Infection of the cabbage looper, bollworm, tobacco budworm, and pink bollworm with spores of Mattesia grandis McLaughlin collected from boll weevils.  J. Invertebr. Pathol. 7: 260-262","5/5/2096","6/14/2099","smb.  there is no mentionof N gasti in thispaper?  But recs in db match data given for Plistophora sp. in the paper.  Was this later idd as Nosema gasti?","",10
"485",539,"McLaughlin, R.E., 1965. Mattesia grandis n. sp., a sporozoan pathogen of the boll weevil, Anthonomus grandis Boheman.  J. Protozool. 12: 405-","5/5/2096","7/8/2096","","",2
"486",540,"Marzke, F.O., and Dicke, R.J., 1958.  Disease-producing protozoa in species of Trogoderma. J. Econ. Entomol. 51: 916-","5/5/2096","7/8/2096","","",1
"487",541,"Hostounsky, Z., 1982. Formation of various morphological types in the spores of Nosema algerae after their oral transfer to Gastrophysa viridula (Coleoptera). J. Protozool. 29: 504-","5/9/2096","3/31/2099","","",1
"488",542,"Hostounsky, Z., and Kodys, F., 1982.  Infection potential of Nosema algerae for the Colorado potato beetle, Leptinotarsa decemlineata.   J. Protozool.  29: 504-","5/9/2096","4/2/2099","","",1
"489",543,"Housounsky, Z., and Kodys, F., 1985.  Infection potential of Nosema algerae to cereal leaf beetles, Oulema melanopus and O. lichenis.  Abstr. Soc. Protozool. 27A.","5/9/2096","7/8/2096","","",2
"490",544,"Vavra, J. and Undeen, A. H., 1970.  Nosema algerae n. sp. (Cnidospora, Microsporida) a pathogen in a laboratory colony of Anopheles stephensi Liston (Diptera, Culicidae). J. Protozool. 17: 240-","5/9/2096","7/16/2097","","",3
"491",545,"Canning, E. U., Wigley, P. J., and Barker, R. J., 1983.  The taxonomy of three species of microsporidia (Protozoa: Microspora) from an oakwoood population of winter moths Operophthera brumata (L.) (Lepidoptera: Geometridae). Syst. Parasitol. 5: 147-159. ","5/11/2096","2/21/2099","","",3
"492",546,"Weiser, J., and Prasertphon, S., 1981.  Four new microsporidia found in the mosquitoes Anopheles gambiae and Culex pipiens quinquefasciatus from Nigeria. Folia Parasitologica 28: 291-301.","5/11/2096","7/8/2096","","",4
"493",547,"Becnel, J.J., and Sweeney, A. W., 1990.  Amblyospora trinus n. sp. (Microsporida: Amblyosporidae) in the Australian mosquito Culex halifaxi (Diptera: Culicidae). J. Protozool.  37: 584-592.","5/11/2096","7/8/2096","","",1
"494",548,"Jouvenaz, D. P., and Hazard, E. I., 1978. New family, genus, and species of Microsporida (Protozoa: Microsporida) from the tropical fire ant, Solenopsis geminata (Fabricius) (Insecta: Formicidae).  J. Protozool. 25: 24-29.","5/11/2096","2/21/2099","","",1
"495",549,"Vavra, J., Bai, M.G., and Panicker, K.N., 1984. Amblyospora indicola sp. n., a microsporidian pathogen of the mosquito Culex sitiens. Folia Parasitologica 31: 207-213.","5/11/2096","7/8/2096","","",1
"496",550,"Larsson, R., 1988. On the taxonomy of the genus Systenostrema Hazard and Oldacre, 1975 (Microspora, Thelohaniidae), with description of two new species.  Syst. Parasitol.  11: 3-17.","5/11/2096","2/21/2099","","",3
"497",551,"Ignoffo, C.M., CRC Handbook of Natural Pesticides. Volume V, Microbial Insecticides, Part A Entomogenous Protozoa and Fungi. CRC Press, Boca Raton, Florida, 1988.","5/11/2096","7/8/2096","","",7
"498",552,"Savage, K.E., 1975. Nosema algerae Vavra and Undeen 1970 (Protozoa: Microsporida): its bionomics and development for use as a biological control agent of mosquitoes, M.S. thesis University of Florida Gainsville.","5/11/2096","7/8/2096","","",11
"499",553,"Maddox, J.V., Alger, N.E., Ahmad, A., and Aslamkhan, M. 1977. The susceptibility of some Pakistan mosquitoes to Nosema algerae (Microsporidia). Pakistan J. Zool. 1: 19-","5/11/2096","7/8/2096","","",4
"500",554,"Undeen, A.H., 1976.  In vivo germination and host specificity of Nosema algerae in mosquitoes. J. Invertebr. Pathol. 27: 343-347.","5/11/2096","2/23/2099","","",3
"501",555,"Hazard, E. I., 1971. Microsporidian diseases in mosquito colonies: Nosema in two Anopheles colonies, pp. 267-271 in International Colloquium on Insect Pathology, IVth, College Park, Maryland, 25-28 August 1970, Proceedings.   ","5/11/2096","7/11/2000","","",2
"502",556,"Fox, R.M., and Weiser, J., 1959. A microsporidian parasite of Anopheles gambiae in Lberia. J. Parasitol. 45: 21-","5/11/2096","7/8/2096","","",2
"503",557,"Bai, M.G., Das, P.K., Gajanana, A., and Rajagopalan, P.K., 1979.  Host-parasite relationship of Nosema algerae, a parasite of mosquitoes.  Indian J. Med. Res. 70: 620-624.","5/11/2096","2/28/2099","","",3
"504",558,"Canning, E. U. and Hulls, R. H., 1970. A microsporidian infection of Anopheles gambiae Giles, from Tanzania, interpretation of its mode of transmission and notes on Nosema infections in mosquitoes. J. Protozool. 17: 531-539.","5/11/2096","7/2/2097","","",5
"505",559,"Hazard, E. I., and Lofgren, C. S. 1971. Tissue specificity and systematics of a Nosema in some species of Aedes, Anopheles, and Culex. J. Invertebr. Pathol. 18: 16-24","5/11/2096","2/21/2099","","",1
"506",560,"Van Essen, F.W., and Anthony, D.W.  1976. Susceptibility of nontarget arganisms to Nosema algerae (Microsporida: Nosematidae), a parasite of mosquitoes. J. Invertebr. Pathol. 28: 77-85","5/11/2096","6/14/2099","smb","",1
"507",561,"Hostounsky, Z. 1984.  Action of the microsporidian Nosema algerae on hosts of different insect orders (Diptera, Lepidoptera, Coleoptera).  J. Protozool. 31: 50A","5/11/2096","4/2/2099","","",2
"508",562,"Undeen, A. H., and Maddox, J.V., 1973. The infection of nonmosquito hosts by injection with spores of the microsporidian Nosema Algerae. J. Invertebr. Pathol. 22: 258-","5/11/2096","7/8/2096","","",NA
"509",563,"Wilson, G.G., 1972. Studies on Nosema fumiferanae a Microsporidian parasite of Choristoneura fumiferana (Clem.) (Lepidoptera: Tortricidae). Ph.D. thesis, Cornell University, Ithaca, N.Y. ","5/11/2096","7/8/2096","","",4
"510",564,"Thomson, H.M., 1960.  A list and brief description of the microsporidia infecting insects. J. Insect. Pathol. 2: 346-","5/11/2096","7/8/2096","","",3
"511",565,"Thomson, H.M., 1958. Some aspects of the epidemiology of a microsporidian parasite of the spruce budworm, Choristoneura fumiferana (Clem). Can. J. Zool. 36: 309-","5/11/2096","7/8/2096","","",NA
"512",567,"Henry, J.E., and Onsager, J.A., 1982. Experimental control of the Mormon cricket, Anabrus simplex, by Nosema locustae (Microspora: Microsporida), a protozoan parasite of grasshoppers (Ort.: Acrididae). Entomophaga 27: 197-","5/12/2096","7/8/2096","","",1
"513",568,"Luna, G.C., Henry, J.E., and Ronderos, R.A., 1981. Infeciones experimentales y naturales con protozoos patogenos en acridios de la Republica Argentina (Insecta, Orthoptera). Rev. Soc. Entomol. Argentina 40: 243-","5/12/2096","7/8/2096","","",12
"514",570,"Wilson, G.G., 1975. Occurrence of Thelohania sp. and Pleistophora sp. (Microsporida: Nosematidae) in Choristoneura fumiferana (Lepidoptera: Tortricidae). Can. J. Zool. 53: 1799-","5/14/2096","7/8/2096","","",6
"515",571,"Issi, I.V., 1971. On polymorphism of the species Pleistophora schubergi  Zwolfer, 1927, possible ways of speciation in the order of Microsporidia. Parazitologiya (Leningrad) 5: 297.","5/14/2096","7/8/2096","","",4
"516",572,"Nilova, G. N., and Strelnikova, L.V., 1974. The effect of ultraviolet irradiation on the viability of spores of Plistophora schubergi Zwolfer and Nosema arotidis Lipa et Issi.  Parazitologiya 8: 463-","5/14/2096","7/8/2096","","",1
"517",573,"Metspalu, L., 1976. On the effect of microsporidiosis on hibernating pupae of noctuids. Eesti NSV Tead. Akad. Toim. Biol. 25: 13.","5/14/2096","7/8/2096","","",7
"518",574,"Wilson, G.G., 1981. The potential of Pleistophora schubergi in microbial control of forest insects. Environ. Can. For. Serv. Inf. Rep. FPM-X-49, Ottawa, Ontario, Canada.","5/14/2096","7/8/2096","","",NA
"519",575,"Simchuk, P.A., 1978. Susceptibility of the codling moth, the pear moth and the plum fruit moth to the mocrosporidium Peistophora schubergi. Biol Nauki. 10: 51.","5/14/2096","7/8/2096","","",3
"520",576,"Gunther, S., 1956. Zut infektion des Goldafters (Euproctis chrysorrhoea L.) mit Plistophora schubergi Zwolfer (Microsporidia). Z. Angew. Zool. 43: 397-405.","5/14/2096","2/5/2097","","",2
"521",577,"Purrini, K., 1982. Light and electron microscopic studies on the microsporidian Pleistophora schubergi neustriae n. subsp. (Microsporida: Phylum Microspora) parasitizing the larvae of Malacosoma neustriae L. (Lymantriidae, Lepidoptera). Arch. Protistenk. 125: 345-","5/14/2096","7/8/2096","","",1
"522",578,"Kaya, H.K., 1977. Survival of spores of Vairimorpha (=Nosema) necatrix (Microsporida: Nosematidae) exposed to sunlight, ultraviolet radiation, and high temperature. J. Invertebr. Pathol. 30: 192-","5/14/2096","7/8/2096","","",1
"523",579,"Maddox, J.V., and Sprenkel, R.K., 1978.  Some enigmatic microsporidia of the genus Nosema. Misc. Publ. Entomol. Soc. Am. 11: 65-84","5/15/2096","4/8/2099","smb","",33
"524",580,"Maddox, J.V., 1966. Studies on a Microsporidiosis of the Armyworm, Pseudaletia unipuncta (Haworth), Ph.D. thesis, University of Illinois, Urbana.","5/15/2096","7/8/2096","","",7
"525",581,"Wilson, G.G., 1984. Pathogenicity of Nosema disstriae, Pleistophora schubergi and Vairimorpha necatrix (Microsporidia) to larvae of the forest tent caterpillar, Malacosoma disstria. Z. Parasitenkd. 70: 763-","5/15/2096","7/12/2096","","",1
"526",582,"Hamm, J.J., and Lynch, R.E., 1982. Comparative susceptibility of the granulate cutworm, fall armyworm, and corn earworm to some entomopathogens. J. Ga. Entomol. Soc. 17: 363-","5/15/2096","7/8/2096","","",1
"527",583,"Tanada, Y., 1962. Effect of a microsporidian spore suspension on the incidence of cytoplasmic polyhedrosis in the alfalfa caterpillar, Colias eurytheme Boisduval. J. Invertebr. Pathol. 4: 495-","5/15/2096","7/8/2096","","",3
"528",584,"Pilley, B. M., 1976. A new genus, Vairimorpha (Protozoa: Microsporida), for Nosema necatrix Kramer 1965: pathogenicity and life cycle in Spodoptera exempta (Lepidoptera: Noctuidae).  J. Invertebr. Pathol. 28:177-","5/15/2096","6/16/2099","smb","",1
"529",585,"Fuxa, J.R., 1981. Susceptibility of lepidopterous pests to two types of mortality caused by the microsporidium Vairimorpha necatrix. J. Econ. Entomol. 74: 99-","5/15/2096","7/8/2096","","",1
"530",586,"Garnham, P.C.C., 1958. Some natural protozoal parasites of mosquitoes with special reference to Crithidia.  Transactions of the First International Conference on Insect Pathology and Biological Control, Prague, Czechoslovakia, pp.  287-294.","5/15/2096","1/23/2099","","",10
"531",587,"Wang, B.T., 1982. The pathobiology of the mosquito parasite: Vavraia culicis (Wiser), Ph.D. thesis, University of California, Los Angeles.","5/15/2096","7/8/2096","","",4
"532",588,"Chapman, H. C., Clark, T. B., Petersen, J. J. and Woodward, D. B., 1969.  A two year survey of of pathogens and parasites of Culicidae, Chaoboridae, and Ceratopogonidae in Louisiana. Proc. N.J. Mosq. Exterm. Assoc. 56: 203-212.","5/15/2096","2/22/2099","","",6
"533",589,"Anon., 1980.  Data sheet on the biological control agent Vavraia (Pleistophora) culicis (Weiser 1946), Mimeographed document, World Health Organization, VBC/80.759, Rome.","5/15/2096","7/8/2096","","",1
"534",590,"Chapman, H. C., 1974.  Biological control of mosquito larvae.  Annual Review of Entomology 19: 33-59.","5/15/2096","2/21/2099","","",9
"535",592,"Garnham, P.C.C., 1956. Microsporidia in laboratory colonies of Anopheles. Bull. WHO. 15: 845-847.","5/15/2096","2/21/2099","","",2
"536",593,"Weiser, J. and Coluzzi, M., 1964.  Plistophora culisetae n. sp.,  a new microsporidian (Protozoa, Cnidosporida) in the mosquito Culiseta longiareolata (Maquart 1838). Riv. Malariol. 43: 51.","5/15/2096","7/8/2096","","",1
"537",594,"Weiser, J., 1978. Production o fthe microsporidian Plistophora culicis Weiser in substitute host. Folia Parasitol. 25: 365-","5/15/2096","7/8/2096","","",1
"538",595,"Sprenkel, R.K., 1973. Studies on Nosema plodiae (Sporozoa, Microsporida) and Mattesia dispora (Sporozoa, Gregarina) pathogens of the Indian Meal moth, Plodia interpunctella (Lepidoptera, Pyralidae) in Illinois. Ph.D. thesis, University of Illinois, Urbana.","5/17/2096","7/8/2096","","",1
"539",596,"Ignoffo, C.M., and Hink, W.F., 1971.  Propagation of arthropod pathogens in living systems.  In, Burges, H.D. and Hussey, N.W. (eds.),  Microbial Control of Insects and Mites.  New York: Academic Press, 1971.","5/17/2096","9/26/2000","","",1
"540",597,"Hostounsky, Z., 1984. Production of microsporidia pathogenic to the Colorado potato beetle (Leptinotarsa decemlineata) in alternate hosts. J. Invertebr. Pathol.  44: 166-171","5/17/2096","4/2/2099","","",5
"541",598,"Pilley, B. M., Canning, E. U. and Hammmond, J. C., 1978.  The use of a microinjection procedure for large scale production of the microsporidian Nosema eurythremae in Pieris brassicae.  J. Invertebr. Pathol. 32: 355-","5/17/2096","7/2/2097","","",1
"542",600,"Nilova, G.N., 1967. Vlijanie mikrospridioza na nekotorye fiziologiceskie funkeii ozimoj sovki (Agrotis segetum Schiff.). Izv. Akda. Nauk Tadzzh. SSR Biol. Otd. 3: 66.","5/17/2096","7/8/2096","","",1
"543",601,"Weiser, J., Prasertphon, S., 1982. Microsporidia infecting Simulium damnosum in Nigeria. Z. ang. Ent. 93: 93-101.","5/19/2096","7/8/2096","","",6
"544",602,"Larsson, R., 1987. Ultrastructural investigation of two new microsporidia with rod-shaped spores with description of Cylindrospora fasciculata sp. nov. and Resiomeria odonatae gen. et sp. nov. (Microspora, Thelohaniidae).  Protistologica 22: 379:398.","5/19/2096","7/8/2096","","",2
"545",603,"Weiser, J., and Purrini, K. 1980. Seven new microsporidian parasites of springtails (Collembola) in the Federal Republic of Germany.  Z. Parasitenkd. 62: 75-84. ","5/19/2096","7/8/2096","","",8
"546",604,"Purrini, K., 1981. Nosema hylobii n. sp. (Nosematidae, Microsporidia), a new microsporidian parasite of Hylobius abietis L. (Curculionidae, Coleoptera). Z. ang. Entomol. 92: 1-8.","5/19/2096","7/8/2096","","",2
"547",605,"Weiser, J., 1968. Plistophora scolyti sp. n. (Protozoa, Microsporidia), a new parasite of Scolytus scolytus F. (Col., Scolytidae). Folia Parasitologica (Prague). 15: 11-14.","5/19/2096","7/8/2096","","",1
"548",606,"Toguebaye, B.S., and Bouix, G., 1983. Nosema manierae sp. n., Microsporidie parasite de Chilo zacconius Blezenski 1970 (Lepidoptera: Pyralidae), hote naturel, et Heliothis armigera (Hubner 1808) (Lepidoptra, Noctuidae), hote experimental: Cycle evolutif et ultrastructure. Z. Parsitenkd. 69: 191-205.","5/26/2096","7/8/2096","","",2
"549",607,"Purrini, K., 1983.  Uber zwei Protozoen-Arten, Adelina tribolii Bhatia comb. nov. (Coccidia) und Nosema ptinidorum n. sp. (Microsporidia) als Krankheitserreger der vorratsschadlichen Kafer Ptinus pusillus Strm. und P. brunneus Dft. (Col. Ptinidae) Z. ang. Entomol. 95: 477-482.","5/26/2096","7/8/2096","","",4
"550",608,"Thomson, H.M., 1959. A microsporidian parasite of the forest tent caterpillar, Malacosoma disstria Hbn.  Can. J. Zool. 37: 217-221.","5/26/2096","7/8/2096","","",1
"551",609,"Odindo, M.O., and Jura, W.G.Z.O., 1992.  Ultrastructure fo Nosema marucae sp. n. (Microspora, Nosematidae), a pathogen of Maruca testualis (Lepidoptera, Pyralidae).  Current Microbiology 25: 319-325.","5/26/2096","7/8/2096","","",1
"552",610,"Purrini, K., and Halperin, J., 1982.  Nosema calcarati n. sp. (Microsporidia), a new parasite of Pityogenes calcaratus Eichhoff (Col. Scolytidae). Z. ang. Entomol. 94: 87-92.","5/26/2096","7/8/2096","","",1
"553",611,"Weiser, J., 1961. A new microsporidian from the bark beetle Pityokteines curvidens Germar (Coleoptera, Scolytidae) in Czechoslovakia. J. Insect. Pathol. 3: 324-329.","5/26/2096","6/16/2099","smb","",1
"554",612,"Lange, C.E., 1987. A new species of Perezia (Microsprida: Perezidae) from the Argentine grasshopper Dichroplus elongatus (Orthoptera: Acrididae). J. Protozool.  34: 34-39.","5/26/2096","7/8/2096","","",1
"555",613,"Dissanaike, A.S., 1955. A new schizogregarine Triboliocystis garnhami n. g., n. sp., and a new microsporidian Nosema buckleyi n. sp., from the fat body of the flour beetle Tribolium castaneum. J. Protozool. 2: 150-156. ","5/26/2096","7/8/2096","","",2
"556",614,"Kudo, R., 1923. Microsporidian parasites of ephemerid nymphs. J. Parasitol. 10: 22-24.","5/26/2096","7/8/2096","","",2
"557",615,"Kalavati, C., and Narasimhamurti, C.C., 1976. A microsporidian parasite, Duboscqia coptotermi sp. n. from the gut of Coptotermes heimi (Wasm.). J. Parasitol. 62: 323-324.","5/26/2096","3/3/2099","","",1
"558",616,"Hazard, E. I., and Federici, B. A., 1985. Ultrastructure and description of a new species of Telomyxa (Microspora: Telomyxidae) from the semiaquatic beetle, Ora texana Champ. (Coleoptera: Helodidae). J. Protozool. 32: 189-194.","5/26/2096","6/24/2099","","",1
"559",617,"Jouvenaz, D.P., and Ellis, E.A., 1986. Vairimorpha invictae n. sp. (Microspora: Microsporidia), a parasite of the red imported fire ant. Solenopsis invicta Buren (Hymenoptera: Formicidae).  J. Protozool. 33: 457-461.","5/27/2096","7/8/2096","","",1
"560",618,"Xie, W. D. and Canning, E. U., 1986. Pyrotheca hydropsycheae n. sp., a microsporidian parasite of caddis fly larvae, Hydropsyche siltalai Dohler, 1963 (Trichoptera, Hydropsychidae).  J. Protozool. 33: 462-467.","5/27/2096","7/2/2097","","",1
